{
  "schemaVersion": 1,
  "qualificationVersion": "client-v1",
  "contractDigest": "0000000000000000000000000000000000000000000000000000000000000000",
  "buildDigests": {
    "development": "0000000000000000000000000000000000000000000000000000000000000000",
    "release": "0000000000000000000000000000000000000000000000000000000000000000"
  },
  "records": []
}
